Unnamed: 0,Key,Item Type,Publication Year,Author,Title,Publication Title,ISBN,ISSN,DOI,Url,Abstract Note,Date,Date Added,Date Modified,Access Date,Pages,Num Pages,Issue,Volume,Number Of Volumes,Journal Abbreviation,Short Title,Series,Series Number,Series Text,Series Title,Publisher,Place,Language,Rights,Type,Archive,Archive Location,Library Catalog,Call Number,Extra,Notes,File Attachments,Link Attachments,Manual Tags,Automatic Tags,Editor,Series Editor,Translator,Contributor,Attorney Agent,Book Author,Cast Member,Commenter,Composer,Cosponsor,Counsel,Interviewer,Producer,Recipient,Reviewed Author,Scriptwriter,Words By,Guest,Number,Edition,Running Time,Scale,Medium,Artwork Size,Filing Date,Application Number,Assignee,Issuing Authority,Country,Meeting Name,Conference Name,Court,References,Reporter,Legal Status,Priority Numbers,Programming Language,Version,System,Code,Code Number,Section,Session,Committee,History,Legislative Body,combined_text,decision,has_abstract,ADPKD?,OMICS?,BIOINFO?,HUMAN DATA?,BIOMARKER?,TRASLATIONAL?,DECISION,COMMENT,MOTIVO
43,ZPF29CF2,journalArticle,2016,"Salih, Mahdi; Demmers, Jeroen A.; Bezstarosti, Karel; Leonhard, Wouter N.; Losekoot, Monique; van Kooten, Cees; Gansevoort, Ron T.; Peters, Dorien J. M.; Zietse, Robert; Hoorn, Ewout J.",Proteomics of Urinary Vesicles Links Plakins and Complement to Polycystic Kidney Disease.,Journal of the American Society of Nephrology : JASN,,1533-3450 1046-6673,10.1681/ASN.2015090994,,"Novel therapies in autosomal dominant polycystic kidney disease (ADPKD) signal the need for markers of disease progression or response to therapy. This study  aimed to identify disease-associated proteins in urinary extracellular vesicles  (uEVs), which include exosomes, in patients with ADPKD. We performed quantitative  proteomics on uEVs from healthy controls and patients with ADPKD using a labeled  approach and then used a label-free approach with uEVs of different subjects  (healthy controls versus patients with ADPKD versus patients with non-ADPKD CKD).  In both experiments, 30 proteins were consistently more abundant (by two-fold or  greater) in ADPKD-uEVs than in healthy- and CKD-uEVs. Of these proteins, we  selected periplakin, envoplakin, villin-1, and complement C3 and C9 for  confirmation because they were also significantly overrepresented in pathway  analysis and were previously implicated in ADPKD pathogenesis. Immunoblotting  confirmed higher abundances of the selected proteins in uEVs from three  independent groups of patients with ADPKD. Whereas uEVs of young patients with  ADPKD and preserved kidney function already had higher levels of complement, only  uEVs of patients with advanced stages of ADPKD had increased levels of villin-1,  periplakin, and envoplakin. Furthermore, all five proteins correlated positively  with total kidney volume. Analysis in kidney tissue from mice with  kidney-specific, tamoxifen-inducible Pkd1 deletion demonstrated higher expression  in more severe stages of the disease and correlation with kidney weight for each  protein of interest. In summary, proteomic analysis of uEVs identified plakins  and complement as disease-associated proteins in ADPKD. These proteins are new  candidates for evaluation as biomarkers or targets for therapy in ADPKD.",2016-10,2025-07-29 13:45:52,2025-07-29 13:45:52,,3079-3092,,10.0,27,,J Am Soc Nephrol,,,,,,,,eng,Copyright © 2016 by the American Society of Nephrology.,,,,,,Place: United States PMID: 26940098  PMCID: PMC5042669,,,,"*Extracellular Vesicles; *Proteomics; ADPKD; Animals; complement; Complement C3/*physiology; Complement C9/*physiology; cytoskeleton; genetic renal disease; Humans; Mice; Plakins/*physiology; Polycystic Kidney, Autosomal Dominant/*etiology; Urine/*chemistry",,,,,,,,,,,,,,,,,,,,,,,,,,,,,,,,,,,,,,,,,,,,,,,,"proteomics of urinary vesicles links plakins and complement to polycystic kidney disease. novel therapies in autosomal dominant polycystic kidney disease (adpkd) signal the need for markers of disease progression or response to therapy. this study  aimed to identify disease-associated proteins in urinary extracellular vesicles  (uevs), which include exosomes, in patients with adpkd. we performed quantitative  proteomics on uevs from healthy controls and patients with adpkd using a labeled  approach and then used a label-free approach with uevs of different subjects  (healthy controls versus patients with adpkd versus patients with non-adpkd ckd).  in both experiments, 30 proteins were consistently more abundant (by two-fold or  greater) in adpkd-uevs than in healthy- and ckd-uevs. of these proteins, we  selected periplakin, envoplakin, villin-1, and complement c3 and c9 for  confirmation because they were also significantly overrepresented in pathway  analysis and were previously implicated in adpkd pathogenesis. immunoblotting  confirmed higher abundances of the selected proteins in uevs from three  independent groups of patients with adpkd. whereas uevs of young patients with  adpkd and preserved kidney function already had higher levels of complement, only  uevs of patients with advanced stages of adpkd had increased levels of villin-1,  periplakin, and envoplakin. furthermore, all five proteins correlated positively  with total kidney volume. analysis in kidney tissue from mice with  kidney-specific, tamoxifen-inducible pkd1 deletion demonstrated higher expression  in more severe stages of the disease and correlation with kidney weight for each  protein of interest. in summary, proteomic analysis of uevs identified plakins  and complement as disease-associated proteins in adpkd. these proteins are new  candidates for evaluation as biomarkers or targets for therapy in adpkd.",,True,True,True,True,True,proteins in uEVs,y,include,,
68,FFXMRKEG,journalArticle,2018,"Raptis, Vassilios; Bakogiannis, Constantinos; Loutradis, Charalampos; Boutou, Afroditi K.; Lampropoulou, Ioanna; Intzevidou, Elena; Sioulis, Athanasios; Balaskas, Elias; Sarafidis, Pantelis A.","Levels of Endocan, Angiopoietin-2, and Hypoxia-Inducible Factor-1a in Patients with Autosomal Dominant Polycystic Kidney Disease and Different Levels of Renal  Function.",American journal of nephrology,,1421-9670 0250-8095,10.1159/000488115,,"BACKGROUND: Endothelial dysfunction leading to unbalanced vasoconstriction and ischemia of renal parenchyma is increasingly proposed as an alternative pathway  of renal damage in autosomal dominant polycystic kidney disease (ADPKD). However,  human studies investigating the evolution of such phenomena are limited. This  study investigated the levels of emerging biomarkers of endothelial function,  angiogenesis and hypoxia, in ADPKD patients with different renal function.  METHODS: The study population consisted of three groups: 26 ADPKD patients with  impaired renal function (Group A; estimated glomerular filtration rate [eGFR]  45-70 mL/min/1.73 m2), 26 ADPKD patients with preserved renal function (Group B;  eGFR >70 mL/min/1.73 m2), and 26 age- and sex-matched controls with no history of  renal disease. Circulating levels of endocan (endothelial cell-specific  molecule-1) angiopoietin-2, and hypoxia-inducible factor-1a (HIF-1a) were  determined by enzyme-linked immunosorbent assay techniques. RESULTS: Patients in  Group A had significantly higher levels of endocan (7.17 ± 0.43 ng/mL),  angiopoietin-2 (5,595.43 ± 3,390), and HIF-1a (163.68 ± 37.84 pg/mL) compared to  patients in Group B (6.86 ± 0.59 ng/mL, p = 0.017, 3,854.41 ± 3,014.30, p =  0.018, 136.84 ± 42.10 pg/mL, p = 0.019 respectively) or controls (4.83 ±  0.69 ng/mL, 1,069 ± 427.88 pg/mL, 70.20 ± 17.49 pg/mL, p < 0.001 for all  comparisons). Of note, patients in Group B had also higher levels of all markers  compared to controls (p < 0.001) despite having similar renal function. In  correlation analyses within ADPKD patients, we noted strong correlations of all  studied markers with asymmetric dimethylarginine (ADMA; endocan r = 0.908, p <  0.001, angiopoietin-2 r = 0.983, p < 0.001 and HIF-1a r = 0.998, p < 0.001), and  only weak or modest correlations with eGFR. CONCLUSIONS: This study suggests that  endothelial dysfunction causing microcirculatory changes, linked to angiogenesis  and hypoxia, may come early in the course of ADPKD and could be a key regulator  of renal injury progression.",2018,2025-07-29 13:45:53,2025-07-29 13:45:53,,231-238,,4.0,47,,Am J Nephrol,,,,,,,,eng,"© 2018 S. Karger AG, Basel.",,,,,,Place: Switzerland PMID: 29597186,,,,"*Neovascularization, Pathologic; ADPKD; Adult; Angiogenesis; Angiopoietin-2/blood; Biomarkers/blood; Case-Control Studies; Chronic kidney disease; Endothelial dysfunction; Endothelium, Vascular/*physiopathology; Female; Glomerular Filtration Rate; Humans; Hypoxia; Hypoxia-Inducible Factor 1, alpha Subunit/blood; Hypoxia/blood/*physiopathology; Male; Middle Aged; Neoplasm Proteins/blood; Polycystic Kidney, Autosomal Dominant/blood/*physiopathology; Proteoglycans/blood",,,,,,,,,,,,,,,,,,,,,,,,,,,,,,,,,,,,,,,,,,,,,,,,"levels of endocan, angiopoietin-2, and hypoxia-inducible factor-1a in patients with autosomal dominant polycystic kidney disease and different levels of renal  function. background: endothelial dysfunction leading to unbalanced vasoconstriction and ischemia of renal parenchyma is increasingly proposed as an alternative pathway  of renal damage in autosomal dominant polycystic kidney disease (adpkd). however,  human studies investigating the evolution of such phenomena are limited. this  study investigated the levels of emerging biomarkers of endothelial function,  angiogenesis and hypoxia, in adpkd patients with different renal function.  methods: the study population consisted of three groups: 26 adpkd patients with  impaired renal function (group a; estimated glomerular filtration rate [egfr]  45-70 ml/min/1.73 m2), 26 adpkd patients with preserved renal function (group b;  egfr >70 ml/min/1.73 m2), and 26 age- and sex-matched controls with no history of  renal disease. circulating levels of endocan (endothelial cell-specific  molecule-1) angiopoietin-2, and hypoxia-inducible factor-1a (hif-1a) were  determined by enzyme-linked immunosorbent assay techniques. results: patients in  group a had significantly higher levels of endocan (7.17 ± 0.43 ng/ml),  angiopoietin-2 (5,595.43 ± 3,390), and hif-1a (163.68 ± 37.84 pg/ml) compared to  patients in group b (6.86 ± 0.59 ng/ml, p = 0.017, 3,854.41 ± 3,014.30, p =  0.018, 136.84 ± 42.10 pg/ml, p = 0.019 respectively) or controls (4.83 ±  0.69 ng/ml, 1,069 ± 427.88 pg/ml, 70.20 ± 17.49 pg/ml, p < 0.001 for all  comparisons). of note, patients in group b had also higher levels of all markers  compared to controls (p < 0.001) despite having similar renal function. in  correlation analyses within adpkd patients, we noted strong correlations of all  studied markers with asymmetric dimethylarginine (adma; endocan r = 0.908, p <  0.001, angiopoietin-2 r = 0.983, p < 0.001 and hif-1a r = 0.998, p < 0.001), and  only weak or modest correlations with egfr. conclusions: this study suggests that  endothelial dysfunction causing microcirculatory changes, linked to angiogenesis  and hypoxia, may come early in the course of adpkd and could be a key regulator  of renal injury progression.",,True,True,True,False,True,"emerging biomarkers of endothelial function,  angiogenesis and hypoxia",y,include,profundizar en qué técnicas usan para decidir,Repasar
52,SHDZSRMG,journalArticle,2018,"Rauniyar, Navin; Yu, Xiaoqing; Cantley, Jennifer; Voss, Edward Z.; Belcher, Justin; Colangelo, Christopher M.; Stone, Kathryn L.; Dahl, Neera; Parikh, Chirag; Lam, TuKiet T.; Cantley, Lloyd G.",Quantification of Urinary Protein Biomarkers of Autosomal Dominant Polycystic Kidney Disease by Parallel Reaction Monitoring.,Proteomics. Clinical applications,,1862-8354 1862-8346,10.1002/prca.201700157,,"PURPOSE: Autosomal dominant polycystic kidney disease (ADPKD) is a life-long disease in which the genes responsible are known, but the pathogenesis of cyst  formation and cyst growth are not understood. Cyst growth ultimately leads to  end-stage renal failure in most patients. Analysis of the urinary proteome offers  the potential to identify proteins that indicate the presence of cysts (and thus  provides diagnosis) as well as the rates of cyst growth (providing prognostic  information). EXPERIMENTAL DESIGN: A scheduled parallel reaction monitoring  (sPRM) assay is performed on urine samples from 14 patients and 18 normal  controls. For relative quantification, stable isotope-labeled synthetic peptides  are spiked in the urinary protein digests prior to data collection. The data are  subsequently normalized to creatinine and protein concentration in the respective  urine samples to control for variations in water intake between individuals.  RESULTS: Out of the 143 urinary proteins targeted for sPRM assay, 69 proteins are  observed to be significantly dysregulated in ADPKD. The dysregulated proteins are  used to cluster ADPKD patients into those who are more or less similar to normal  controls. CONCLUSIONS AND CLINICAL RELEVANCE: This study shows that sPRM is a  promising approach to rapidly screen large numbers of proteins in urine in order  to provide earlier diagnosis and potentially better understand the pathogenesis  of ADPKD development and progression.",2018-09,2025-07-29 13:45:53,2025-07-29 13:45:53,,e1700157,,5.0,12,,Proteomics Clin Appl,,,,,,,,eng,"© 2018 WILEY-VCH Verlag GmbH & Co. KGaA, Weinheim.",,,,,,Place: Germany PMID: 29573172  PMCID: PMC6736530,,,,"autosomal dominant polycystic kidney disease; Biomarkers/*urine; Female; Humans; Kidney/metabolism/pathology; label-free quantification; Male; parallel reaction monitoring; Polycystic Kidney, Autosomal Dominant/genetics/pathology/*urine; Proteins/chemistry/*genetics; Proteome/genetics; targeted mass spectrometry; urinary proteomics; Urine/*chemistry",,,,,,,,,,,,,,,,,,,,,,,,,,,,,,,,,,,,,,,,,,,,,,,,"quantification of urinary protein biomarkers of autosomal dominant polycystic kidney disease by parallel reaction monitoring. purpose: autosomal dominant polycystic kidney disease (adpkd) is a life-long disease in which the genes responsible are known, but the pathogenesis of cyst  formation and cyst growth are not understood. cyst growth ultimately leads to  end-stage renal failure in most patients. analysis of the urinary proteome offers  the potential to identify proteins that indicate the presence of cysts (and thus  provides diagnosis) as well as the rates of cyst growth (providing prognostic  information). experimental design: a scheduled parallel reaction monitoring  (sprm) assay is performed on urine samples from 14 patients and 18 normal  controls. for relative quantification, stable isotope-labeled synthetic peptides  are spiked in the urinary protein digests prior to data collection. the data are  subsequently normalized to creatinine and protein concentration in the respective  urine samples to control for variations in water intake between individuals.  results: out of the 143 urinary proteins targeted for sprm assay, 69 proteins are  observed to be significantly dysregulated in adpkd. the dysregulated proteins are  used to cluster adpkd patients into those who are more or less similar to normal  controls. conclusions and clinical relevance: this study shows that sprm is a  promising approach to rapidly screen large numbers of proteins in urine in order  to provide earlier diagnosis and potentially better understand the pathogenesis  of adpkd development and progression.",,True,True,False,False,True,urinary proteins,y,include,necesito profundizar en si usan omics/bioinfo,Repasar
47,BS7P4CAL,journalArticle,2019,"Evenepoel, Pieter; Claes, Kathleen; Cavalier, Etienne; Meijers, Bjorn; Stenvinkel, Peter; Behets, Geert; Jankowska, Magdalena; D'Haese, Patrick; Bammens, Bert",A distinct bone phenotype in ADPKD patients with end-stage renal disease.,Kidney international,,1523-1755 0085-2538,10.1016/j.kint.2018.09.018,,"Autosomal dominant polycystic kidney disease (ADPKD) is among the most common hereditary nephropathies. Low bone turnover osteopenia has been reported in mice  with conditional deletion of the PKD1 and PKD2 genes in osteoblasts, and  preliminary clinical data also suggest suppressed bone turnover in patients with  ADPKD. The present study compared the bone phenotype between patients with end  stage renal disease (ESRD) due to ADPKD and controls with ESRD due to other  causes. Laboratory parameters of bone mineral metabolism (fibroblast growth  factor 23 and sclerostin), bone turnover markers (bone alkaline phosphatase,  tartrate-resistant acid phosphatase 5b) and bone mineral density (BMD, by dual  energy x-ray absorptiometry, DXA) were assessed in 518 patients with ESRD,  including 99 with ADPKD. Bone histomorphometry data were available in 71  patients, including 10 with ADPKD. Circulating levels of bone alkaline  phosphatase were significantly lower in patients with ADPKD (17.4 vs 22.6 ng/mL),  as were histomorphometric parameters of bone formation. Associations between  ADPKD and parameters of bone formation persisted after adjustment for classical  determinants including parathyroid hormone, age, and sex. BMD was higher in  skeletal sites rich in cortical bone in patients with ADPKD compared to non-ADPKD  patients (Z-score midshaft radius -0.04 vs -0.14; femoral neck -0.72 vs -1.02).  Circulating sclerostin levels were significantly higher in ADPKD patients (2.20  vs 1.84 ng/L). In conclusion, patients with ESRD due to ADPKD present a distinct  bone and mineral phenotype, characterized by suppressed bone turnover, better  preserved cortical BMD, and high sclerostin levels.",2019-02,2025-07-29 13:45:53,2025-07-29 13:45:53,,412-419,,2.0,95,,Kidney Int,,,,,,,,eng,Copyright © 2019 International Society of Nephrology. Published by Elsevier Inc. All rights reserved.,,,,,,Place: United States PMID: 30665572,,,,"Absorptiometry, Photon; Adaptor Proteins, Signal Transducing; ADPKD; Adult; Aged; Animals; Biomarkers/blood; bone; Bone and Bones/cytology/diagnostic imaging/physiopathology; Bone Density/physiology; Bone Diseases, Metabolic/blood/*etiology/physiopathology; Bone Morphogenetic Proteins/blood; Bone Remodeling/*physiology; Case-Control Studies; Cilia/pathology/physiology; Female; Genetic Markers; Humans; Kidney Failure, Chronic/blood/*pathology; Male; Mice; Middle Aged; mineral metabolism; Osteoblasts/cytology/pathology; Polycystic Kidney, Autosomal Dominant/*complications/pathology/physiopathology",,,,,,,,,,,,,,,,,,,,,,,,,,,,,,,,,,,,,,,,,,,,,,,,"a distinct bone phenotype in adpkd patients with end-stage renal disease. autosomal dominant polycystic kidney disease (adpkd) is among the most common hereditary nephropathies. low bone turnover osteopenia has been reported in mice  with conditional deletion of the pkd1 and pkd2 genes in osteoblasts, and  preliminary clinical data also suggest suppressed bone turnover in patients with  adpkd. the present study compared the bone phenotype between patients with end  stage renal disease (esrd) due to adpkd and controls with esrd due to other  causes. laboratory parameters of bone mineral metabolism (fibroblast growth  factor 23 and sclerostin), bone turnover markers (bone alkaline phosphatase,  tartrate-resistant acid phosphatase 5b) and bone mineral density (bmd, by dual  energy x-ray absorptiometry, dxa) were assessed in 518 patients with esrd,  including 99 with adpkd. bone histomorphometry data were available in 71  patients, including 10 with adpkd. circulating levels of bone alkaline  phosphatase were significantly lower in patients with adpkd (17.4 vs 22.6 ng/ml),  as were histomorphometric parameters of bone formation. associations between  adpkd and parameters of bone formation persisted after adjustment for classical  determinants including parathyroid hormone, age, and sex. bmd was higher in  skeletal sites rich in cortical bone in patients with adpkd compared to non-adpkd  patients (z-score midshaft radius -0.04 vs -0.14; femoral neck -0.72 vs -1.02).  circulating sclerostin levels were significantly higher in adpkd patients (2.20  vs 1.84 ng/l). in conclusion, patients with esrd due to adpkd present a distinct  bone and mineral phenotype, characterized by suppressed bone turnover, better  preserved cortical bmd, and high sclerostin levels.",,True,True,True,False,True,varios,y,include,necesito profundizar en si utilizan omicas/bioinfo,Repasar
24,LF5UQYRV,journalArticle,2019,"Kocyigit, Ismail; Ozturk, Fahir; Eroglu, Eray; Karaca, Zuleyha; Kaynar, Ahmet Safa; Cetin, Mustafa; Tokgoz, Bulent; Sipahioglu, Murat Hayri; Bayramov, Ruslan; Sen, Ahmet; Oymak, Oktay; Ecder, Tevfik; Axelsson, Jonas",Dysmetabolic markers predict outcomes in autosomal dominant polycystic kidney disease.,Clinical and experimental nephrology,,1437-7799 1342-1751,10.1007/s10157-019-01748-z,,"BACKGROUND: Overweight and obesity were recently associated with a poor prognosis in patients with autosomal dominant polycystic kidney disease (ADPKD). Whether  the metabolic consequences of obesity as defined by the metabolic syndrome (MS)  are also linked with disease progression remains untested. METHODS: Eligible  ADPKD patients with different stages of CKD (n = 105) and 105 non-diabetic  controls matched for CKD stage were enrolled in the study. Groups were evaluated  at baseline for presence of MS, blood markers of metabolism, homeostasis model  assessment of insulin resistance (HOMA-IR) score, and biochemical markers of  inflammation (hs-CRP, IL-1β, IL-6, TNF-α and PON-1). MS was defined according to  the National Cholesterol Education Program-Adult Treatment Panel III (NCEP-ATP  III). Patients were followed for 12 months and progression defined as a decrease  in baseline eGFR > 10%. RESULTS: MS and hypertension were more prevalent amongst  ADPKD patients than in the control group. Meanwhile, markers of inflammation such  as hs-CRP (3.63 [3.45-5.17] vs. 4.2 [3.45-8.99] mg/dL; p = 0.014), IL-6 (21.65  [14.1-27.49] vs. 24.9 [16.23-39.4] pg/mL; p = 0.004) and IL-1β (21.33 [15.8-26.4]  vs. 26.78 [18.22-35] pg/mL; p < 0.001) levels were all more elevated in ADPKD  patients than in non-diabetic CKD subjects. In multivariate analysis having a  truncating PKD1 mutation predicted (OR 1.25 [1.09-1.43]; p = 0.002) fulfilling  the MS criteria. Finally, ADPKD patients fulfilling MS criteria had a  significantly more rapid progression during 12 months of follow-up than did those  that did not (OR 3.28 [1.09-9.87]; p = 0.035). CONCLUSIONS: Our data supports the  notion that dysmetabolisms part of the ADPKD phenotype and associated with a poor  outcome, especially in patients with a truncating PKD1 mutation.",2019-09,2025-07-29 13:45:52,2025-07-29 13:45:52,,1130-1140,,9.0,23,,Clin Exp Nephrol,,,,,,,,eng,,,,,,,Place: Japan PMID: 31134465,,,,"*Energy Metabolism; *Mutation; Adult; Biomarkers/blood; Case-Control Studies; Disease Progression; Female; Genetic Predisposition to Disease; Humans; Hypertension/diagnosis/epidemiology; Inflammation Mediators/*blood; Male; Metabolic syndrome; Metabolic Syndrome/blood/diagnosis/*epidemiology/genetics; Middle Aged; Obesity; Phenotype; PKD1 mutation; Polycystic kidney disease; Polycystic Kidney, Autosomal Dominant/diagnosis/*epidemiology/genetics; Prevalence; Renal Insufficiency, Chronic/diagnosis/*epidemiology/genetics; Renal progression; Risk Factors; Time Factors; TRPP Cation Channels/*genetics; Turkey",,,,,,,,,,,,,,,,,,,,,,,,,,,,,,,,,,,,,,,,,,,,,,,,"dysmetabolic markers predict outcomes in autosomal dominant polycystic kidney disease. background: overweight and obesity were recently associated with a poor prognosis in patients with autosomal dominant polycystic kidney disease (adpkd). whether  the metabolic consequences of obesity as defined by the metabolic syndrome (ms)  are also linked with disease progression remains untested. methods: eligible  adpkd patients with different stages of ckd (n = 105) and 105 non-diabetic  controls matched for ckd stage were enrolled in the study. groups were evaluated  at baseline for presence of ms, blood markers of metabolism, homeostasis model  assessment of insulin resistance (homa-ir) score, and biochemical markers of  inflammation (hs-crp, il-1β, il-6, tnf-α and pon-1). ms was defined according to  the national cholesterol education program-adult treatment panel iii (ncep-atp  iii). patients were followed for 12 months and progression defined as a decrease  in baseline egfr > 10%. results: ms and hypertension were more prevalent amongst  adpkd patients than in the control group. meanwhile, markers of inflammation such  as hs-crp (3.63 [3.45-5.17] vs. 4.2 [3.45-8.99] mg/dl; p = 0.014), il-6 (21.65  [14.1-27.49] vs. 24.9 [16.23-39.4] pg/ml; p = 0.004) and il-1β (21.33 [15.8-26.4]  vs. 26.78 [18.22-35] pg/ml; p < 0.001) levels were all more elevated in adpkd  patients than in non-diabetic ckd subjects. in multivariate analysis having a  truncating pkd1 mutation predicted (or 1.25 [1.09-1.43]; p = 0.002) fulfilling  the ms criteria. finally, adpkd patients fulfilling ms criteria had a  significantly more rapid progression during 12 months of follow-up than did those  that did not (or 3.28 [1.09-9.87]; p = 0.035). conclusions: our data supports the  notion that dysmetabolisms part of the adpkd phenotype and associated with a poor  outcome, especially in patients with a truncating pkd1 mutation.",,True,True,False,False,True,"presence of MS, blood markers of metabolism, HOMA-IR score and biochemical markers of inflammation hs-CRP, IL-1β, IL-6, TNF-α and PON-1",y,include,no sé si usan ómicas/bioinfo... profundizar para decidir,Repasar
