57,P9ZJIA4M,journalArticle,2021,"Raby, Katie L.; Horsely, Harry; McCarthy-Boxer, Aidan; Norman, Jill T.; Wilson, Patricia D.",Urinary exosome proteomic profiling defines stage-specific rapid progression of autosomal dominant polycystic kidney disease and tolvaptan efficacy.,BBA advances,,2667-1603,10.1016/j.bbadva.2021.100013,,"ADPKD is the most common genetic disease of the kidney leading to end-stage renal disease necessitating renal replacement therapy at any time between the 1(st) and  8(th) decades of life due to widely variable rates of disease progression. This  presents significant patient anxiety and a significant prognostic and therapeutic  challenge. Tolvaptan is the only approved drug licensed to slow ADPKD progression  by reducing renal cystic expansion but side-effects can limit its efficacy. To  address the need to identify new biomarkers to monitor progression of ADPKD and  to evaluate the therapeutic effects of Tolvaptan, proteomic analysis was  conducted on defined (40-100nm) urinary exosomes isolated from ADPKD patients  phenotyped and clinically monitored over a 10-year period. Comparative Gene  Ontology analysis of Tandem Mass Tag labelled mass spectrometry-derived protein  profiles from urinary exosomes from ADPKD patients with rapid (>10ml/min/5 years  decline in estimated glomerular filtration rate) versus slow progression showed  distinctive patterns of pathway up-regulation. Clear discrimination between rapid  and slowly-progressive profiles were seen in all stages functional decline in  ADPKD patients whether with mild (>70ml/min), moderate (50-69ml/min) or severe  (<49ml/min) disease at onset. Discriminatory pathways and proteins included  Notch-, integrin- and growth factor-signalling; microtubular kinase, vesicular  proteins and epidermal growth factor substrates. Confocal microscopy of  fluorescently-labelled normal versus ADPKD epithelial cell-derived exosomes in  vitro also identified ADPKD-dependent abnormalities in intracellular vesicular  trafficking and implicated changes in ADPKD-dependent exosome secretion and  target cell uptake as factors underlying urinary exosome excretion biomarker  properties. Comparative proteomic analysis of urinary exosomal proteins in  individual patients before and after treatment with Tolvaptan for 4 years also  identified distinct patterns of pathway modification dependent on the degree of  effectiveness of the therapeutic response. Up-regulation of Wnt-pathway and  vesicular proteins were characteristic of urinary exosomes from ADPKD patients  with good responses to Tolvaptan while upregulation of angiogenesis pathways and  additional molecular forms of vasopressin receptor AVPR2 were characteristic in  urinary exosomes of ADPKD patients with poor responses. Taken together, these  studies conclude that proteomic profiling of urinary exosome biomarkers provides  a specific, sensitive and practical non-invasive method to identify and monitor  the rate of disease progression and the effects of Tolvaptan therapy in  individual ADPKD patients. This provides a means to identify those patients most  likely to benefit maximally from therapy and to progress towards a  personalization of ADPKD prognosis and management.",2021,2025-07-29 13:45:53,2025-07-29 13:45:53,,100013,,,1,,BBA Adv,,,,,,,,eng,© 2021 The Authors. Published by Elsevier B.V.,,,,,,Place: Netherlands PMID: 37082007  PMCID: PMC10074914,,,,ADPKD progression; Exosomes; Proteomics; Tolvaptan effects; Urinary biomarkers; Vesicular trafficking,,,,,,,,,,,,,,,,,,,,,,,,,,,,,,,,,,,,,,,,,,,,,,,,"urinary exosome proteomic profiling defines stage-specific rapid progression of autosomal dominant polycystic kidney disease and tolvaptan efficacy. adpkd is the most common genetic disease of the kidney leading to end-stage renal disease necessitating renal replacement therapy at any time between the 1(st) and  8(th) decades of life due to widely variable rates of disease progression. this  presents significant patient anxiety and a significant prognostic and therapeutic  challenge. tolvaptan is the only approved drug licensed to slow adpkd progression  by reducing renal cystic expansion but side-effects can limit its efficacy. to  address the need to identify new biomarkers to monitor progression of adpkd and  to evaluate the therapeutic effects of tolvaptan, proteomic analysis was  conducted on defined (40-100nm) urinary exosomes isolated from adpkd patients  phenotyped and clinically monitored over a 10-year period. comparative gene  ontology analysis of tandem mass tag labelled mass spectrometry-derived protein  profiles from urinary exosomes from adpkd patients with rapid (>10ml/min/5 years  decline in estimated glomerular filtration rate) versus slow progression showed  distinctive patterns of pathway up-regulation. clear discrimination between rapid  and slowly-progressive profiles were seen in all stages functional decline in  adpkd patients whether with mild (>70ml/min), moderate (50-69ml/min) or severe  (<49ml/min) disease at onset. discriminatory pathways and proteins included  notch-, integrin- and growth factor-signalling; microtubular kinase, vesicular  proteins and epidermal growth factor substrates. confocal microscopy of  fluorescently-labelled normal versus adpkd epithelial cell-derived exosomes in  vitro also identified adpkd-dependent abnormalities in intracellular vesicular  trafficking and implicated changes in adpkd-dependent exosome secretion and  target cell uptake as factors underlying urinary exosome excretion biomarker  properties. comparative proteomic analysis of urinary exosomal proteins in  individual patients before and after treatment with tolvaptan for 4 years also  identified distinct patterns of pathway modification dependent on the degree of  effectiveness of the therapeutic response. up-regulation of wnt-pathway and  vesicular proteins were characteristic of urinary exosomes from adpkd patients  with good responses to tolvaptan while upregulation of angiogenesis pathways and  additional molecular forms of vasopressin receptor avpr2 were characteristic in  urinary exosomes of adpkd patients with poor responses. taken together, these  studies conclude that proteomic profiling of urinary exosome biomarkers provides  a specific, sensitive and practical non-invasive method to identify and monitor  the rate of disease progression and the effects of tolvaptan therapy in  individual adpkd patients. this provides a means to identify those patients most  likely to benefit maximally from therapy and to progress towards a  personalization of adpkd prognosis and management.",,True,True,True,True,True,proteomic analysis of urinary exosomes,y,include,,
61,Q9N34V5E,journalArticle,2022,"Dekker, Shosha E. I.; Verhoeven, Aswin; Frey, Daria; Soonawala, Darius; Peters, Dorien J. M.; Mayboroda, Oleg A.; de Fijter, Johan W.",Change in Urinary Myoinositol/Citrate Ratio Associates with Progressive Loss of Renal Function in ADPKD Patients.,American journal of nephrology,,1421-9670 0250-8095,10.1159/000524851,,"INTRODUCTION: In autosomal dominant polycystic kidney disease (ADPKD) patients, predicting renal disease progression is important to make a prognosis and to  support the clinical decision whether to initiate renoprotective therapy.  Conventional markers all have their limitations. Metabolic profiling is a  promising strategy for risk stratification. We determined the prognostic  performance to identify patients with a fast progressive disease course and  evaluated time-dependent changes in urinary metabolites. METHODS: Targeted,  quantitative metabolomics analysis (1H NMR-spectroscopy) was performed on spot  urinary samples at two time points, baseline (n = 324, 61% female; mean age 45  years, SD 11; median eGFR 61 mL/min/1.73 m2, IQR 42-88; mean years of creatinine  follow-up 3.7, SD 1.3) and a sample obtained after 3 years of follow-up (n =  112). Patients were stratified by their eGFR slope into fast and slow progressors  based on an annualized change of > -3.0 or ≤ -3.0 mL/min/1.73 m2/year,  respectively. Fifty-five urinary metabolites and ratios were quantified, and the  significant ones were selected. Logistic regression was used to determine  prognostic performance in identifying those with a fast progressive course using  baseline urine samples. Repeated-measures ANOVA was used to analyze whether  changes in urinary metabolites over a 3-year follow-up period differed between  fast and slow progressors. RESULTS: In a single urinary sample, the prognostic  performance of urinary metabolites was comparable to that of a model including  height-adjusted total kidney volume (htTKV, AUC = 0.67). Combined with htTKV, the  predictive value of the metabolite model increased (AUC = 0.75). Longitudinal  analyses showed an increase in the myoinositol/citrate ratio (p < 0.001) in fast  progressors, while no significant change was found in those with slow  progression, which is in-line with an overall increase in the myoinositol/citrate  ratio as GFR declines. CONCLUSION: A metabolic profile, measured at a single time  point, showed at least equivalent prognostic performance to an imaging-based risk  marker in ADPKD. Changes in urinary metabolites over a 3-year follow-up period  were associated with a fast progressive disease course.",2022,2025-07-29 13:45:53,2025-07-29 13:45:53,,470-480,,6.0,53,,Am J Nephrol,,,,,,,,eng,"© 2022 The Author(s). Published by S. Karger AG, Basel.",,,,,,Place: Switzerland PMID: 35613556  PMCID: PMC9393825,,,,"*Polycystic Kidney, Autosomal Dominant; Autosomal dominant polycystic kidney disease; Biomarker; Citric Acid/metabolism; Disease Progression; Estimated glomerular filtration rate slope; Female; Glomerular Filtration Rate; Humans; Inositol/metabolism; Kidney; Male; Middle Aged; Progression; Urine metabolites",,,,,,,,,,,,,,,,,,,,,,,,,,,,,,,,,,,,,,,,,,,,,,,,"change in urinary myoinositol/citrate ratio associates with progressive loss of renal function in adpkd patients. introduction: in autosomal dominant polycystic kidney disease (adpkd) patients, predicting renal disease progression is important to make a prognosis and to  support the clinical decision whether to initiate renoprotective therapy.  conventional markers all have their limitations. metabolic profiling is a  promising strategy for risk stratification. we determined the prognostic  performance to identify patients with a fast progressive disease course and  evaluated time-dependent changes in urinary metabolites. methods: targeted,  quantitative metabolomics analysis (1h nmr-spectroscopy) was performed on spot  urinary samples at two time points, baseline (n = 324, 61% female; mean age 45  years, sd 11; median egfr 61 ml/min/1.73 m2, iqr 42-88; mean years of creatinine  follow-up 3.7, sd 1.3) and a sample obtained after 3 years of follow-up (n =  112). patients were stratified by their egfr slope into fast and slow progressors  based on an annualized change of > -3.0 or ≤ -3.0 ml/min/1.73 m2/year,  respectively. fifty-five urinary metabolites and ratios were quantified, and the  significant ones were selected. logistic regression was used to determine  prognostic performance in identifying those with a fast progressive course using  baseline urine samples. repeated-measures anova was used to analyze whether  changes in urinary metabolites over a 3-year follow-up period differed between  fast and slow progressors. results: in a single urinary sample, the prognostic  performance of urinary metabolites was comparable to that of a model including  height-adjusted total kidney volume (httkv, auc = 0.67). combined with httkv, the  predictive value of the metabolite model increased (auc = 0.75). longitudinal  analyses showed an increase in the myoinositol/citrate ratio (p < 0.001) in fast  progressors, while no significant change was found in those with slow  progression, which is in-line with an overall increase in the myoinositol/citrate  ratio as gfr declines. conclusion: a metabolic profile, measured at a single time  point, showed at least equivalent prognostic performance to an imaging-based risk  marker in adpkd. changes in urinary metabolites over a 3-year follow-up period  were associated with a fast progressive disease course.",,True,True,True,True,True,metabolomic,,include,,
29,9FSAFKUA,journalArticle,2022,"Kim, Hyunsuk; Sung, Jinmo; Bae, Ju Young; Lee, Poongyeon; Oh, Yun Kyu; Kim, Hyunho",Identification of osteopontin as a urinary biomarker for autosomal dominant polycystic kidney disease progression.,Kidney research and clinical practice,,2211-9132 2211-9140,10.23876/j.krcp.21.303,,"BACKGROUND: Autosomal dominant polycystic kidney disease (ADPKD), one of the most common human monogenic diseases, is characterized by the presence of numerous  fluid-filled renal cysts and is a leading cause of end-stage renal disease  (ESRD). Urinary biomarkers may be useful for predicting the variable course of  ADPKD progression from cyst growth to ESRD. METHODS: To identify candidate  urinary biomarkers of ADPKD progression, we used CRISPR/Cas9 genome editing to  generate porcine fibroblasts with mono- and biallelic ADPKD gene knockout  (PKD2+/- and PKD2-/-, respectively). We then performed RNA-sequencing analysis on  these cells. RESULTS: Levels of osteopontin (OPN), which is expressed by renal  epithelial tubular cells and excreted into urine, were reduced in PKD2-/- cells  but not in PKD2+/- cells. OPN levels were also reduced in the renal cyst cells of  ADPKD patients. Next, we investigated whether OPN excretion was decreased in  patients with ADPKD via enzyme-linked immunosorbent assay. OPN levels excreted  into renal cyst cell culture media and urine from ADPKD patients were decreased.  To investigate whether OPN can predict the rate of ADPKD progression, we compared  urinary excretion of OPN in ADPKD patients with slow progression and those with  rapid progression. Those with rapid progression had an estimated glomerular  filtration rate of &gt;60 mL/min/1.73 m2 . Urinary OPN excretion levels were  lower in rapid progressors than in slow progressors. CONCLUSION: These findings  suggest that OPN is a useful urinary biomarker for predicting ADPKD progression.",2022-11,2025-07-29 13:45:52,2025-07-29 13:45:52,,730-740,,6.0,41,,Kidney Res Clin Pract,,,,,,,,eng,,,,,,,Place: Korea (South) PMID: 35791741  PMCID: PMC9731784,,,,Autosomal dominant polycystic kidney disease; Biomarkers; Clustered regularly interspaced short palindromic repeats/Cas9; Osteopontin,,,,,,,,,,,,,,,,,,,,,,,,,,,,,,,,,,,,,,,,,,,,,,,,"identification of osteopontin as a urinary biomarker for autosomal dominant polycystic kidney disease progression. background: autosomal dominant polycystic kidney disease (adpkd), one of the most common human monogenic diseases, is characterized by the presence of numerous  fluid-filled renal cysts and is a leading cause of end-stage renal disease  (esrd). urinary biomarkers may be useful for predicting the variable course of  adpkd progression from cyst growth to esrd. methods: to identify candidate  urinary biomarkers of adpkd progression, we used crispr/cas9 genome editing to  generate porcine fibroblasts with mono- and biallelic adpkd gene knockout  (pkd2+/- and pkd2-/-, respectively). we then performed rna-sequencing analysis on  these cells. results: levels of osteopontin (opn), which is expressed by renal  epithelial tubular cells and excreted into urine, were reduced in pkd2-/- cells  but not in pkd2+/- cells. opn levels were also reduced in the renal cyst cells of  adpkd patients. next, we investigated whether opn excretion was decreased in  patients with adpkd via enzyme-linked immunosorbent assay. opn levels excreted  into renal cyst cell culture media and urine from adpkd patients were decreased.  to investigate whether opn can predict the rate of adpkd progression, we compared  urinary excretion of opn in adpkd patients with slow progression and those with  rapid progression. those with rapid progression had an estimated glomerular  filtration rate of &gt;60 ml/min/1.73 m2 . urinary opn excretion levels were  lower in rapid progressors than in slow progressors. conclusion: these findings  suggest that opn is a useful urinary biomarker for predicting adpkd progression.",,True,True,True,True,True,urinary osteopontin levels,y,include,,
21,KJNIFNYZ,journalArticle,2022,"Kocyigit, Ismail; Taheri, Serpil; Uysal, Cihan; Memis, Mehmet; Ozayturk, Salih Guntug; Zararsiz, Gokmen; Rassoulzadegan, Minoo",Predicting Progression of Autosomal Dominant Polycystic Kidney Disease by Changes in the Telomeric Epigenome.,Cells,,2073-4409,10.3390/cells11203300,,"Autosomal dominant polycystic kidney disease (ADPKD) is the most common inherited cause of chronic kidney disease with Polycystin&nbsp;(PKD) 1 and 2 gene mutation.  However, the intra-familial variability in symptoms further suggests a  non-Mendelian contribution to the disease. Our goal was to find a marker to track  the epigenetic changes common to rapidly progressing forms of the disease. The  risk of ADPKD increases with age, and aging shortens the telomere length (TL).  Telomeres are a nucleoprotein structure composed mainly of three complexes,  shelterin, CST and RNA-containing telomere repeat(TERRA), which protects the ends  of chromosomes from degradation and fusion, and plays a role in maintaining  cellular stability and in the repair of telomeric damage. TERRAs are transcribed  from telomeric regions and a part of them is engaged in a DNA/RNA hybrid (R-loop)  at each chromosome end. We tracked TL and TERRA levels in blood samples of 78  patients and 20 healthy control. Our study demonstrates that TL was shortened and  TERRA expression levels in the DNA-attached fraction increased in autosomal  dominant polycystic kidney patients with mutations in PKD1 and PKD2 compared to  the control group. Moreover, it was observed that the expression of TERRA engaged  in the R-loop was higher and the length of telomeres shorter in patients with  ADPKD who showed rapid disease progression. Intrafamilial variation in TL and  TERRA levels with the same mutation would indicate reliable epigenetic potential  biomarkers in disease monitoring.",2022-10-20,2025-07-29 13:45:52,2025-07-29 13:45:52,,,,20.0,11,,Cells,,,,,,,,eng,,,,,,,Place: Switzerland PMID: 36291168  PMCID: PMC9600909,,,,"*Polycystic Kidney, Autosomal Dominant/genetics; *RNA, Long Noncoding/genetics; DNA; epigenetics; Epigenome; genome integrity; Humans; lncRNA; Nucleoproteins/metabolism; polycystic kidney disease; R-loop; telomere; Telomere/genetics/metabolism; TERRAs; TRPP Cation Channels/genetics",,,,,,,,,,,,,,,,,,,,,,,,,,,,,,,,,,,,,,,,,,,,,,,,"predicting progression of autosomal dominant polycystic kidney disease by changes in the telomeric epigenome. autosomal dominant polycystic kidney disease (adpkd) is the most common inherited cause of chronic kidney disease with polycystin&nbsp;(pkd) 1 and 2 gene mutation.  however, the intra-familial variability in symptoms further suggests a  non-mendelian contribution to the disease. our goal was to find a marker to track  the epigenetic changes common to rapidly progressing forms of the disease. the  risk of adpkd increases with age, and aging shortens the telomere length (tl).  telomeres are a nucleoprotein structure composed mainly of three complexes,  shelterin, cst and rna-containing telomere repeat(terra), which protects the ends  of chromosomes from degradation and fusion, and plays a role in maintaining  cellular stability and in the repair of telomeric damage. terras are transcribed  from telomeric regions and a part of them is engaged in a dna/rna hybrid (r-loop)  at each chromosome end. we tracked tl and terra levels in blood samples of 78  patients and 20 healthy control. our study demonstrates that tl was shortened and  terra expression levels in the dna-attached fraction increased in autosomal  dominant polycystic kidney patients with mutations in pkd1 and pkd2 compared to  the control group. moreover, it was observed that the expression of terra engaged  in the r-loop was higher and the length of telomeres shorter in patients with  adpkd who showed rapid disease progression. intrafamilial variation in tl and  terra levels with the same mutation would indicate reliable epigenetic potential  biomarkers in disease monitoring.",,True,True,True,True,True,TL and TERRA,ns,include,,
92,C3QIXSSV,journalArticle,2023,"Fang, Hui; Xue, Kai; Yang, Teng",Identification of ADPKD-Related Key miRNAs by Constructing a miRNA-mRNA Interaction Network and Experimental Verification,PAKISTAN JOURNAL OF ZOOLOGY,,0030-9923,10.17582/journal.pjz/20210728090730,,"There are many physiological processes that rely on the microRNA-messenger RNA (miRNA-mRNA) network. In this study, an analysis of miRNA-mRNA networks was conducted to identify miRNAs linked Omnibus (GEO) database were obtained to identify differentially expressed miRNAs (DEMs) and genes (DEGs) in the progression of ADPKD. Functional annotation and enrichment analysis of DEG were performed. iRegulon was used to construct the miRNA-mRNA network and predict related transcription factors (TFs) associated with ADPKD. The function of miRNA network was explored by analyzing GO and KEGG enrichment. Further, qRT-PCR was performed in vitro to determine the expression of miRNAs and mRNAs associated with ADPKD. In the results, 2 DEMs and 1090 DEGs were identified. While DEGs that were downregulated tended to be enriched for metabolic pathways, DEGs that were upregulated tended to be enriched for beta-alanine metabolism, alanine, aspartate, and glutamate metabolism. The miRNA-mRNA network consisted of 2 miRNAs (miR-199a-3p and miR-107) and 7 mRNAs. It appears that miRNAs may positively regulate fibroblast migration, calcium signaling, and cell division based on GO and KEGG analysis. What's more, by detecting the expression of the key ADPKDrelated miRNA-mRNA in vitro experiments, two miRNAs (miR-199a-3p, miR-107) and four candidate RUNX1 Partner Transcriptional Co-Repressor 1, RUNX1T1; and Fibroblast growth factor 2, FGF2) were identified. In conclusion, ADPKD may be better understood by examining the novel miRNA-mRNA network we constructed.",2023-12,2025-07-29 13:46:57,2025-07-29 13:46:57,2024-02-04,2901-2910,,6.0,55,,,,,,,,,,,,,,WOS:001144365800006,,,,,,,,,,,,,,,,,,,,,,,,,,,,,,,,,,,,,,,,,,,,,,,,,,,,,,,"identification of adpkd-related key mirnas by constructing a mirna-mrna interaction network and experimental verification there are many physiological processes that rely on the microrna-messenger rna (mirna-mrna) network. in this study, an analysis of mirna-mrna networks was conducted to identify mirnas linked omnibus (geo) database were obtained to identify differentially expressed mirnas (dems) and genes (degs) in the progression of adpkd. functional annotation and enrichment analysis of deg were performed. iregulon was used to construct the mirna-mrna network and predict related transcription factors (tfs) associated with adpkd. the function of mirna network was explored by analyzing go and kegg enrichment. further, qrt-pcr was performed in vitro to determine the expression of mirnas and mrnas associated with adpkd. in the results, 2 dems and 1090 degs were identified. while degs that were downregulated tended to be enriched for metabolic pathways, degs that were upregulated tended to be enriched for beta-alanine metabolism, alanine, aspartate, and glutamate metabolism. the mirna-mrna network consisted of 2 mirnas (mir-199a-3p and mir-107) and 7 mrnas. it appears that mirnas may positively regulate fibroblast migration, calcium signaling, and cell division based on go and kegg analysis. what's more, by detecting the expression of the key adpkdrelated mirna-mrna in vitro experiments, two mirnas (mir-199a-3p, mir-107) and four candidate runx1 partner transcriptional co-repressor 1, runx1t1; and fibroblast growth factor 2, fgf2) were identified. in conclusion, adpkd may be better understood by examining the novel mirna-mrna network we constructed.",,True,True,True,True,True,miRNAs,ns,include,,
